{
  "schemaVersion": "v1",
  "featureId": "feature_short_return_bps_v1",
  "featureKey": "short_return_bps",
  "version": "1.0.0",
  "title": "Short-window return",
  "summary": "Short-window signed return used by directional signal templates.",
  "status": "active",
  "marketType": "spot",
  "venueKeys": ["jupiter", "magicblock", "phoenix"],
  "assetKeys": ["SOL", "USDC"],
  "pairSymbols": ["SOL/USDC"],
  "inputRequirements": [
    {
      "inputKey": "mid_price_usd",
      "required": true,
      "freshnessMs": 20000,
      "notes": "Seed feature definition input requirement."
    }
  ],
  "derivedFromFeatureKeys": [],
  "freshnessSloMs": 20000,
  "maxAllowedDriftBps": 50,
  "minCoverageBps": 10000,
  "provenance": {
    "generatedBy": "strategy-lab::feature-catalog",
    "generatedRevision": "seed",
    "generatedAt": "2026-03-10T00:00:00.000Z",
    "notes": "Generated from checked-in runtime fixtures and catalog defaults."
  },
  "datasetSnapshots": [
    {
      "datasetId": "dataset_feed_replay_sol_usdc_market_events",
      "snapshotId": "snapshot_2026_03_07_seed",
      "capturedAt": "2026-03-10T00:00:00.000Z",
      "uri": "repo://docs/runtime-contracts/fixtures/runtime-feed-replay.sol_usdc.v1.json#marketEvents",
      "contentDigest": "sha256:fixture"
    },
    {
      "datasetId": "dataset_feed_replay_sol_usdc_slot_events",
      "snapshotId": "snapshot_2026_03_07_seed",
      "capturedAt": "2026-03-10T00:00:00.000Z",
      "uri": "repo://docs/runtime-contracts/fixtures/runtime-feed-replay.sol_usdc.v1.json#slotEvents",
      "contentDigest": "sha256:fixture"
    }
  ],
  "createdAt": "2026-03-10T00:00:00.000Z",
  "updatedAt": "2026-03-10T00:00:00.000Z",
  "tags": ["signal", "seed"],
  "notes": "Seed feature definition for the runtime feature catalog."
}
